{
  "schema_version": "1.0",
  "last_updated": "2026-05-07",
  "history": [
    {
      "timestamp": "2026-05-07",
      "level_used": 3,
      "level_assigned": 3,
      "intent_primary": "决策",
      "intent_secondary": "分析",
      "language": "zh",
      "pressure_strategy": "regret pre-mortem + hidden-assumption exposure",
      "strategy_skipped": null,
      "angle_selected": "risk-first",
      "paths_presented": ["risk-first", "counter-intuitive", "minimalist"],
      "user_choice": "single",
      "choice_detail": "A: risk-first (recommended)",
      "feedback": "great",
      "outcome_score": null,
      "outcome_note": null,
      "context_role": "产品经理+独立开发者",
      "context_tech_stack": null,
      "context_budget": "~200/月",
      "context_team_size": null,
      "context_domain": "AI选型",
      "context_constraints": "只买一个会员，要求最新最强"
    },
    {
      "timestamp": "2026-05-06",
      "level_used": 3,
      "level_assigned": 2,
      "intent_primary": "决策",
      "intent_secondary": "对比",
      "language": "zh",
      "pressure_strategy": "regret pre-mortem + difference stress test",
      "strategy_skipped": null,
      "angle_selected": "counter-intuitive",
      "paths_presented": ["risk-first", "counter-intuitive", "adversarial"],
      "user_choice": "combination",
      "choice_detail": "A+B: risk-first + counter-intuitive",
      "feedback": "great",
      "outcome_score": null,
      "outcome_note": null,
      "context_role": "产品经理",
      "context_tech_stack": null,
      "context_budget": null,
      "context_team_size": null,
      "context_domain": "脚手架设计",
      "context_constraints": "管理后台、BaseAdmin"
    },
    {
      "timestamp": "2026-05-05",
      "level_used": 3,
      "level_assigned": 3,
      "intent_primary": "规划",
      "intent_secondary": null,
      "language": "zh",
      "pressure_strategy": "backward planning",
      "strategy_skipped": null,
      "angle_selected": "time-horizon",
      "paths_presented": ["time-horizon", "risk-first", "minimalist"],
      "user_choice": "combination",
      "choice_detail": "A+B: time-horizon + risk-first",
      "feedback": "great",
      "outcome_score": null,
      "outcome_note": null,
      "context_role": "软考备考",
      "context_tech_stack": null,
      "context_budget": null,
      "context_team_size": null,
      "context_domain": "系统架构设计师",
      "context_constraints": "2026年5月考试"
    },
    {
      "timestamp": "2026-05-04",
      "level_used": 3,
      "level_assigned": 3,
      "intent_primary": "验证",
      "intent_secondary": "分析",
      "language": "zh",
      "pressure_strategy": "devil's judgment",
      "strategy_skipped": null,
      "angle_selected": "adversarial",
      "paths_presented": ["adversarial", "hidden-assumption", "peer-compare"],
      "user_choice": "combination",
      "choice_detail": "A+B: adversarial + hidden-assumption",
      "feedback": "great",
      "outcome_score": null,
      "outcome_note": null,
      "context_role": "独立开发者",
      "context_tech_stack": "SharpInput skill",
      "context_budget": null,
      "context_team_size": 1,
      "context_domain": "skill优化",
      "context_constraints": "DARWIN Score优化"
    },
    {
      "timestamp": "2026-05-03",
      "level_used": 3,
      "level_assigned": 3,
      "intent_primary": "决策",
      "intent_secondary": "对比",
      "language": "zh",
      "pressure_strategy": "regret pre-mortem + difference stress test",
      "strategy_skipped": null,
      "angle_selected": "risk-first",
      "paths_presented": ["risk-first", "counter-intuitive", "adversarial"],
      "user_choice": "combination",
      "choice_detail": "B+C: counter-intuitive + adversarial",
      "feedback": "great",
      "outcome_score": null,
      "outcome_note": null,
      "context_role": "开发者",
      "context_tech_stack": "CPU/系统",
      "context_budget": null,
      "context_team_size": null,
      "context_domain": "硬件选型",
      "context_constraints": null
    },
    {
      "timestamp": "2026-05-02",
      "level_used": 3,
      "level_assigned": 2,
      "intent_primary": "决策",
      "intent_secondary": "分析",
      "language": "zh",
      "pressure_strategy": "regret pre-mortem",
      "strategy_skipped": null,
      "angle_selected": "risk-first",
      "paths_presented": ["risk-first", "hidden-assumption", "minimalist"],
      "user_choice": "single",
      "choice_detail": "A: risk-first",
      "feedback": null,
      "outcome_score": null,
      "outcome_note": null,
      "context_role": "产品经理",
      "context_tech_stack": null,
      "context_budget": "~6000",
      "context_team_size": null,
      "context_domain": "笔记本/系统选择",
      "context_constraints": null
    },
    {
      "timestamp": "2026-05-02",
      "level_used": 3,
      "level_assigned": 3,
      "intent_primary": "决策",
      "intent_secondary": null,
      "language": "zh",
      "pressure_strategy": "regret pre-mortem",
      "strategy_skipped": null,
      "angle_selected": "risk-first",
      "paths_presented": ["risk-first", "counter-intuitive", "adversarial"],
      "user_choice": "combination",
      "choice_detail": "A+B: risk-first + counter-intuitive",
      "feedback": "great",
      "outcome_score": null,
      "outcome_note": null,
      "context_role": null,
      "context_tech_stack": null,
      "context_budget": null,
      "context_team_size": null,
      "context_domain": "系统选择",
      "context_constraints": null
    },
    {
      "timestamp": "2026-05-02",
      "level_used": 3,
      "level_assigned": 3,
      "intent_primary": "决策",
      "intent_secondary": "对比",
      "language": "zh",
      "pressure_strategy": "regret pre-mortem + difference stress test",
      "strategy_skipped": null,
      "angle_selected": "risk-first",
      "paths_presented": ["risk-first", "counter-intuitive", "adversarial"],
      "user_choice": "single",
      "choice_detail": "A: risk-first (recommended)",
      "feedback": "great",
      "outcome_score": null,
      "outcome_note": null,
      "context_role": null,
      "context_tech_stack": null,
      "context_budget": null,
      "context_team_size": null,
      "context_domain": "laptop选择",
      "context_constraints": null
    },
    {
      "timestamp": "2026-05-02",
      "level_used": 3,
      "level_assigned": 3,
      "intent_primary": "决策",
      "intent_secondary": null,
      "language": "zh",
      "pressure_strategy": "regret pre-mortem",
      "strategy_skipped": null,
      "angle_selected": "risk-first",
      "paths_presented": ["risk-first", "counter-intuitive", "adversarial"],
      "user_choice": "single",
      "choice_detail": "A: risk-first",
      "feedback": null,
      "outcome_score": null,
      "outcome_note": null,
      "context_role": null,
      "context_tech_stack": null,
      "context_budget": null,
      "context_team_size": null,
      "context_domain": "laptop选择",
      "context_constraints": null
    }
  ],
  "summary": {
    "level_bias": {
      "total_sessions": 9,
      "level_distribution": {"0": 0, "1": 0, "2": 0, "3": 9},
      "top_level_pct": 100
    },
    "angle_preference": ["risk-first", "adversarial", "counter-intuitive"],
    "avoided_angles": [],
    "intent_history": {"决策": 6, "分析": 3, "验证": 1, "规划": 1, "对比": 3},
    "intent_priming": {
      "primary_intent_top3": ["决策", "分析", "对比"],
      "corrections": {}
    },
    "correction_map": {},
    "strategy_feedback": {
      "regret pre-mortem": {"total": 6, "skipped": 0, "positive": 3, "negative": 0},
      "hidden-assumption exposure": {"total": 2, "skipped": 0, "positive": 1, "negative": 0},
      "difference stress test": {"total": 3, "skipped": 0, "positive": 1, "negative": 0}
    },
    "context_autofill": {
      "role": "产品经理+独立开发者",
      "tech_stack": "SharpInput skill",
      "budget": "~6000",
      "team_size": 1,
      "domain": "互联网/Web开发",
      "common_constraints": "预算有限、短期出成果"
    }
  }
}
